<?xml version="1.0" encoding="utf-8"?>
<l:localization xmlns:g="http://www.shaman-sir.by.ru/XSD/Generic"
        xmlns:l="http://www.shaman-sir.by.ru/XSD/Localization"        
        xmlns:xsi="http://www.w3.org/2001/XMLSchema-instance" 
        xsi:schemaLocation="http://www.shaman-sir.by.ru/XSD/Localization ./xsd/localization.xsd">
  <l:language id="en">
    <l:string id="l:definition-label">Site definition, which is usually background image</l:string>
    <l:string id="l:site-introduction">welcome to shaman.sir homesite :: please feel yourself safe</l:string>
    <l:string id="l:a">enn</l:string>
  </l:language>
  <l:language id="ru">
    <l:string id="l:definition-label">Описание сайта, по умолчанию представляющее собой фоновое изображение</l:string>
    <l:string id="l:site-introduction">добро пожаловать на домашнюю страницу shaman.sir :: пожалуйста чувствуйте себя комфортно</l:string>
    <l:string id="l:a">rru</l:string>
  </l:language>  
</l:localization>
